{
    "id": "MAP_CELADON_CONDOMINIUMS_LEFT_ELEVATOR",
    "name": "Celadon_CondominiumsLeftElevator",
    "code": "T07R0206",
    "layout": "NARC_map_matrix_map_matrix_0262_D31R0202_bin",
    "music_day": "SEQ_GS_C_TAMAMUSHI",
    "music_night": "SEQ_GS_C_TAMAMUSHI",
    "region_map_section": "MAPSEC_CELADON_CITY",
    "weather": 0,
    "map_type": "MAP_TYPE_INTERIOR",
    "battle_scene": "BATTLE_BG_BUILDING_1",
    "allow_cycling": false,
    "allow_escaping": false,
    "allow_running": true,
    "allow_fly": false,
    "allow_outgoing_calls": true,
    "allow_incoming_calls": true,
    "radio_signal": true,
    "wild_encounters": "ENCDATA_NA",
    "camera_type": 4,
    "follow_mode": "MAP_FOLLOWMODE_HEIGHT_RESTRICT",
    "region": "MAP_REGION_KANTO",
    "area_icon": 9,
    "mom_call_intro": 12,
    "world_map_x": 38,
    "world_map_y": 7,
    "area_data": 44,
    "move_model_bank": 15,
    "object_events": [],
    "warp_events": [
        {
            "x": 3,
            "y": 6,
            "elevation": 0,
            "dest_map": 4095,
            "dest_warp_id": 256
        }
    ],
    "coord_events": [],
    "bg_events": []
}
