{
    "id": "MAP_MAHOGANY_POKECENTER_B1F",
    "name": "Mahogany_Pokecenter_B1F",
    "code": "T28PC0102",
    "layout": "NARC_map_matrix_map_matrix_0077_T27PC0105_bin",
    "music_day": "SEQ_GS_POKESEN",
    "music_night": "SEQ_GS_POKESEN",
    "region_map_section": "MAPSEC_MAHOGANY_TOWN",
    "weather": 0,
    "map_type": "MAP_TYPE_INTERIOR",
    "battle_scene": "BATTLE_BG_BUILDING_1",
    "allow_cycling": false,
    "allow_escaping": false,
    "allow_running": true,
    "allow_fly": false,
    "allow_outgoing_calls": true,
    "allow_incoming_calls": true,
    "radio_signal": true,
    "wild_encounters": "ENCDATA_NA",
    "camera_type": 4,
    "follow_mode": "MAP_FOLLOWMODE_HEIGHT_RESTRICT",
    "region": "MAP_REGION_JOHTO",
    "area_icon": 9,
    "mom_call_intro": 10,
    "world_map_x": 16,
    "world_map_y": 5,
    "area_data": 26,
    "move_model_bank": 15,
    "object_events": [
        {
            "local_id": "obj_T28PC0102_wifisf",
            "graphics_id": "SPRITE_WIFISF",
            "x": 4,
            "y": 4,
            "elevation": 0,
            "movement_type": "MOVEMENT_TYPE_FACE_DOWN",
            "movement_range_x": 0,
            "movement_range_y": 0,
            "facing_dir": "DIR_SOUTH",
            "trainer_type": "OBJECT_TYPE_NORMAL",
            "trainer_sight_or_param0": 0,
            "param1": 0,
            "param2": 0,
            "script": "std_wifi_reception",
            "flag": "FLAG_NOTHING"
        },
        {
            "local_id": "obj_T28PC0102_pcwoman2",
            "graphics_id": "SPRITE_PCWOMAN2",
            "x": 8,
            "y": 4,
            "elevation": 0,
            "movement_type": "MOVEMENT_TYPE_FACE_DOWN",
            "movement_range_x": 0,
            "movement_range_y": 0,
            "facing_dir": "DIR_SOUTH",
            "trainer_type": "OBJECT_TYPE_NORMAL",
            "trainer_sight_or_param0": 0,
            "param1": 0,
            "param2": 0,
            "script": "std_wifi_pichu_check",
            "flag": "FLAG_NOTHING"
        },
        {
            "local_id": "obj_T28PC0102_pcwoman2_2",
            "graphics_id": "SPRITE_PCWOMAN2",
            "x": 12,
            "y": 4,
            "elevation": 0,
            "movement_type": "MOVEMENT_TYPE_FACE_DOWN",
            "movement_range_x": 0,
            "movement_range_y": 0,
            "facing_dir": "DIR_SOUTH",
            "trainer_type": "OBJECT_TYPE_NORMAL",
            "trainer_sight_or_param0": 0,
            "param1": 0,
            "param2": 0,
            "script": "std_teala_subsequent_talk",
            "flag": "FLAG_NOTHING"
        }
    ],
    "warp_events": [
        {
            "x": 14,
            "y": 10,
            "elevation": 0,
            "dest_map": "MAP_MAHOGANY_POKECENTER_1F",
            "dest_warp_id": 1
        }
    ],
    "coord_events": [],
    "bg_events": []
}
