{
    "id": "MAP_CELADON_CONDOMINIUMS_1F",
    "name": "Celadon_Condominiums_1F",
    "code": "T07R0201",
    "layout": "NARC_map_matrix_map_matrix_0221_T07R0201_bin",
    "music_day": "SEQ_GS_C_TAMAMUSHI",
    "music_night": "SEQ_GS_C_TAMAMUSHI",
    "region_map_section": "MAPSEC_CELADON_CITY",
    "weather": 0,
    "map_type": "MAP_TYPE_INTERIOR",
    "battle_scene": "BATTLE_BG_BUILDING_1",
    "allow_cycling": false,
    "allow_escaping": false,
    "allow_running": true,
    "allow_fly": false,
    "allow_outgoing_calls": true,
    "allow_incoming_calls": true,
    "radio_signal": true,
    "wild_encounters": "ENCDATA_NA",
    "camera_type": 4,
    "follow_mode": "MAP_FOLLOWMODE_HEIGHT_RESTRICT",
    "region": "MAP_REGION_KANTO",
    "area_icon": 9,
    "mom_call_intro": 12,
    "world_map_x": 38,
    "world_map_y": 7,
    "area_data": 39,
    "move_model_bank": 15,
    "object_events": [
        {
            "local_id": "obj_T07R0201_gsoldwoman1",
            "graphics_id": "SPRITE_GSOLDWOMAN1",
            "x": 13,
            "y": 4,
            "elevation": 0,
            "movement_type": "MOVEMENT_TYPE_LOOK_DOWN_LEFT",
            "movement_range_x": 0,
            "movement_range_y": 0,
            "facing_dir": "DIR_WEST",
            "trainer_type": "OBJECT_TYPE_NORMAL",
            "trainer_sight_or_param0": 0,
            "param1": 0,
            "param2": 0,
            "script": "Celadon_Condominiums_1F_EventScript_OldWoman",
            "flag": "FLAG_NOTHING"
        },
        {
            "local_id": "obj_T07R0201_tsure_poke_static_meowth",
            "graphics_id": "SPRITE_FOLLOWER_MON_STATIC_MEOWTH",
            "x": 11,
            "y": 6,
            "elevation": 0,
            "movement_type": "MOVEMENT_TYPE_LOOK_AROUND",
            "movement_range_x": 0,
            "movement_range_y": 0,
            "facing_dir": "DIR_EAST",
            "trainer_type": "OBJECT_TYPE_NORMAL",
            "trainer_sight_or_param0": 0,
            "param1": 0,
            "param2": 0,
            "script": "Celadon_Condominiums_1F_EventScript_Meowth",
            "flag": "FLAG_NOTHING"
        },
        {
            "local_id": "obj_T07R0201_tsure_poke_static_clefairy",
            "graphics_id": "SPRITE_FOLLOWER_MON_STATIC_CLEFAIRY",
            "x": 12,
            "y": 3,
            "elevation": 0,
            "movement_type": "MOVEMENT_TYPE_FACE_DOWN",
            "movement_range_x": 0,
            "movement_range_y": 0,
            "facing_dir": "DIR_SOUTH",
            "trainer_type": "OBJECT_TYPE_NORMAL",
            "trainer_sight_or_param0": 0,
            "param1": 0,
            "param2": 0,
            "script": "Celadon_Condominiums_1F_EventScript_Clefairy",
            "flag": "FLAG_NOTHING"
        },
        {
            "local_id": "obj_T07R0201_tsure_poke_static_nidoran_f",
            "graphics_id": "SPRITE_FOLLOWER_MON_STATIC_NIDORAN_F",
            "x": 7,
            "y": 4,
            "elevation": 0,
            "movement_type": "MOVEMENT_TYPE_WANDER_AROUND",
            "movement_range_x": 1,
            "movement_range_y": 1,
            "facing_dir": "DIR_SOUTH",
            "trainer_type": "OBJECT_TYPE_NORMAL",
            "trainer_sight_or_param0": 0,
            "param1": 0,
            "param2": 0,
            "script": "Celadon_Condominiums_1F_EventScript_NidoranF",
            "flag": "FLAG_NOTHING"
        }
    ],
    "warp_events": [
        {
            "x": 7,
            "y": 13,
            "elevation": 0,
            "dest_map": "MAP_CELADON",
            "dest_warp_id": 1
        },
        {
            "x": 13,
            "y": 10,
            "elevation": 0,
            "dest_map": "MAP_CELADON_CONDOMINIUMS_2F",
            "dest_warp_id": 0
        },
        {
            "x": 3,
            "y": 2,
            "elevation": 0,
            "dest_map": "MAP_CELADON_CONDOMINIUMS_LEFT_ELEVATOR",
            "dest_warp_id": 0
        }
    ],
    "coord_events": [],
    "bg_events": [
        {
            "type": "BG_TYPE_NORMAL",
            "x": 5,
            "y": 2,
            "elevation": 0,
            "player_facing_dir": "BG_DIR_ALL",
            "script": "Celadon_Condominiums_1F_EventScript_PleaseTakeThisElevatorSign"
        }
    ]
}
