{
    "id": "MAP_ICE_PATH_B2F",
    "name": "IcePath_B2F",
    "code": "D39R0103",
    "layout": "NARC_map_matrix_map_matrix_0134_D39R0103_bin",
    "music_day": "SEQ_GS_D_KOORINONUKE",
    "music_night": "SEQ_GS_D_KOORINONUKE",
    "region_map_section": "MAPSEC_ICE_PATH",
    "weather": 0,
    "map_type": "MAP_TYPE_CAVE",
    "battle_scene": "BATTLE_BG_CAVE_3",
    "allow_cycling": true,
    "allow_escaping": true,
    "allow_running": true,
    "allow_fly": false,
    "allow_outgoing_calls": true,
    "allow_incoming_calls": true,
    "radio_signal": true,
    "wild_encounters": "ENCDATA_D39R0103",
    "camera_type": 0,
    "follow_mode": "MAP_FOLLOWMODE_ALLOW",
    "region": "MAP_REGION_JOHTO",
    "area_icon": 4,
    "mom_call_intro": 8,
    "world_map_x": 21,
    "world_map_y": 4,
    "area_data": 76,
    "move_model_bank": 15,
    "object_events": [
        {
            "local_id": "obj_D39R0103_rock",
            "graphics_id": "SPRITE_ROCK",
            "x": 12,
            "y": 13,
            "elevation": 0,
            "movement_type": "MOVEMENT_TYPE_NONE",
            "movement_range_x": 0,
            "movement_range_y": 0,
            "facing_dir": "DIR_NORTH",
            "trainer_type": "OBJECT_TYPE_NORMAL",
            "trainer_sight_or_param0": 0,
            "param1": 0,
            "param2": 0,
            "script": "_EV_scr_seq_D39R0103_002 + 1",
            "flag": "FLAG_HIDE_ICE_PATH_BOULDER_1_FALLEN"
        },
        {
            "local_id": "obj_D39R0103_rock_2",
            "graphics_id": "SPRITE_ROCK",
            "x": 11,
            "y": 21,
            "elevation": 0,
            "movement_type": "MOVEMENT_TYPE_NONE",
            "movement_range_x": 0,
            "movement_range_y": 0,
            "facing_dir": "DIR_NORTH",
            "trainer_type": "OBJECT_TYPE_NORMAL",
            "trainer_sight_or_param0": 0,
            "param1": 0,
            "param2": 0,
            "script": "_EV_scr_seq_D39R0103_002 + 1",
            "flag": "FLAG_HIDE_ICE_PATH_BOULDER_2_FALLEN"
        },
        {
            "local_id": "obj_D39R0103_rock_3",
            "graphics_id": "SPRITE_ROCK",
            "x": 19,
            "y": 10,
            "elevation": 0,
            "movement_type": "MOVEMENT_TYPE_NONE",
            "movement_range_x": 0,
            "movement_range_y": 0,
            "facing_dir": "DIR_NORTH",
            "trainer_type": "OBJECT_TYPE_NORMAL",
            "trainer_sight_or_param0": 0,
            "param1": 0,
            "param2": 0,
            "script": "_EV_scr_seq_D39R0103_002 + 1",
            "flag": "FLAG_HIDE_ICE_PATH_BOULDER_3_FALLEN"
        },
        {
            "local_id": "obj_D39R0103_rock_4",
            "graphics_id": "SPRITE_ROCK",
            "x": 20,
            "y": 22,
            "elevation": 0,
            "movement_type": "MOVEMENT_TYPE_NONE",
            "movement_range_x": 0,
            "movement_range_y": 0,
            "facing_dir": "DIR_NORTH",
            "trainer_type": "OBJECT_TYPE_NORMAL",
            "trainer_sight_or_param0": 0,
            "param1": 0,
            "param2": 0,
            "script": "_EV_scr_seq_D39R0103_002 + 1",
            "flag": "FLAG_HIDE_ICE_PATH_BOULDER_4_FALLEN"
        },
        {
            "local_id": "obj_D39R0103_monstarball",
            "graphics_id": "SPRITE_MONSTARBALL",
            "x": 57,
            "y": 24,
            "elevation": 0,
            "movement_type": "MOVEMENT_TYPE_NONE",
            "movement_range_x": 0,
            "movement_range_y": 0,
            "facing_dir": "DIR_NORTH",
            "trainer_type": "OBJECT_TYPE_NORMAL",
            "trainer_sight_or_param0": 0,
            "param1": 0,
            "param2": 0,
            "script": "std_itemball_d39r0103_tm72",
            "flag": "FLAG_HIDE_ITEMBALL_D39R0103_TM72"
        },
        {
            "local_id": "obj_D39R0103_monstarball_2",
            "graphics_id": "SPRITE_MONSTARBALL",
            "x": 15,
            "y": 15,
            "elevation": 0,
            "movement_type": "MOVEMENT_TYPE_NONE",
            "movement_range_x": 0,
            "movement_range_y": 0,
            "facing_dir": "DIR_NORTH",
            "trainer_type": "OBJECT_TYPE_NORMAL",
            "trainer_sight_or_param0": 0,
            "param1": 0,
            "param2": 0,
            "script": "std_itemball_d39r0103_full_heal",
            "flag": "FLAG_HIDE_ITEMBALL_D39R0103_FULL_HEAL"
        },
        {
            "local_id": "obj_D39R0103_monstarball_3",
            "graphics_id": "SPRITE_MONSTARBALL",
            "x": 5,
            "y": 12,
            "elevation": 0,
            "movement_type": "MOVEMENT_TYPE_NONE",
            "movement_range_x": 0,
            "movement_range_y": 0,
            "facing_dir": "DIR_NORTH",
            "trainer_type": "OBJECT_TYPE_NORMAL",
            "trainer_sight_or_param0": 0,
            "param1": 0,
            "param2": 0,
            "script": "std_itemball_d39r0103_max_potion",
            "flag": "FLAG_HIDE_ITEMBALL_D39R0103_MAX_POTION"
        }
    ],
    "warp_events": [
        {
            "x": 26,
            "y": 11,
            "elevation": 0,
            "dest_map": "MAP_ICE_PATH_B1F",
            "dest_warp_id": 2
        },
        {
            "x": 26,
            "y": 10,
            "elevation": 0,
            "dest_map": "MAP_ICE_PATH_B1F",
            "dest_warp_id": 2
        },
        {
            "x": 16,
            "y": 17,
            "elevation": 0,
            "dest_map": "MAP_ICE_PATH_B3F",
            "dest_warp_id": 0
        },
        {
            "x": 50,
            "y": 5,
            "elevation": 0,
            "dest_map": "MAP_ICE_PATH_B3F",
            "dest_warp_id": 2
        },
        {
            "x": 43,
            "y": 22,
            "elevation": 0,
            "dest_map": "MAP_ICE_PATH_B1F",
            "dest_warp_id": 3
        },
        {
            "x": 43,
            "y": 21,
            "elevation": 0,
            "dest_map": "MAP_ICE_PATH_B1F",
            "dest_warp_id": 3
        }
    ],
    "coord_events": [],
    "bg_events": [
        {
            "type": "BG_TYPE_HIDDEN_ITEM",
            "x": 26,
            "y": 26,
            "elevation": 0,
            "player_facing_dir": "BG_DIR_ALL",
            "script": "std_hiddenitem_d39r0103_carbos"
        }
    ]
}
