{
    "id": "MAP_CELADON_CONDOMINIUMS_3F",
    "name": "Celadon_Condominiums_3F",
    "code": "T07R0203",
    "layout": "NARC_map_matrix_map_matrix_0223_T07R0203_bin",
    "music_day": "SEQ_GS_C_TAMAMUSHI",
    "music_night": "SEQ_GS_C_TAMAMUSHI",
    "region_map_section": "MAPSEC_CELADON_CITY",
    "weather": 0,
    "map_type": "MAP_TYPE_INTERIOR",
    "battle_scene": "BATTLE_BG_BUILDING_1",
    "allow_cycling": false,
    "allow_escaping": false,
    "allow_running": true,
    "allow_fly": false,
    "allow_outgoing_calls": true,
    "allow_incoming_calls": true,
    "radio_signal": true,
    "wild_encounters": "ENCDATA_NA",
    "camera_type": 4,
    "follow_mode": "MAP_FOLLOWMODE_HEIGHT_RESTRICT",
    "region": "MAP_REGION_KANTO",
    "area_icon": 9,
    "mom_call_intro": 12,
    "world_map_x": 38,
    "world_map_y": 7,
    "area_data": 39,
    "move_model_bank": 15,
    "object_events": [
        {
            "local_id": "obj_T07R0203_gsman1",
            "graphics_id": "SPRITE_GSMAN1",
            "x": 1,
            "y": 7,
            "elevation": 0,
            "movement_type": "MOVEMENT_TYPE_FACE_UP",
            "movement_range_x": 0,
            "movement_range_y": 0,
            "facing_dir": "DIR_NORTH",
            "trainer_type": "OBJECT_TYPE_NORMAL",
            "trainer_sight_or_param0": 0,
            "param1": 0,
            "param2": 0,
            "script": "_EV_scr_seq_T07R0203_002 + 1",
            "flag": "FLAG_NOTHING"
        },
        {
            "local_id": "obj_T07R0203_sunglasses",
            "graphics_id": "SPRITE_SUNGLASSES",
            "x": 14,
            "y": 10,
            "elevation": 0,
            "movement_type": "MOVEMENT_TYPE_FACE_UP",
            "movement_range_x": 0,
            "movement_range_y": 0,
            "facing_dir": "DIR_NORTH",
            "trainer_type": "OBJECT_TYPE_NORMAL",
            "trainer_sight_or_param0": 0,
            "param1": 0,
            "param2": 0,
            "script": "_EV_scr_seq_T07R0203_001 + 1",
            "flag": "FLAG_NOTHING"
        },
        {
            "local_id": "obj_T07R0203_gsbigman",
            "graphics_id": "SPRITE_GSBIGMAN",
            "x": 6,
            "y": 9,
            "elevation": 0,
            "movement_type": "MOVEMENT_TYPE_FACE_UP",
            "movement_range_x": 0,
            "movement_range_y": 0,
            "facing_dir": "DIR_NORTH",
            "trainer_type": "OBJECT_TYPE_NORMAL",
            "trainer_sight_or_param0": 0,
            "param1": 0,
            "param2": 0,
            "script": "_EV_scr_seq_T07R0203_003 + 1",
            "flag": "FLAG_NOTHING"
        },
        {
            "local_id": "obj_T07R0203_gsman3",
            "graphics_id": "SPRITE_GSMAN3",
            "x": 8,
            "y": 5,
            "elevation": 0,
            "movement_type": "MOVEMENT_TYPE_WANDER_LEFT_RIGHT",
            "movement_range_x": 2,
            "movement_range_y": 0,
            "facing_dir": "DIR_WEST",
            "trainer_type": "OBJECT_TYPE_NORMAL",
            "trainer_sight_or_param0": 0,
            "param1": 0,
            "param2": 0,
            "script": "_EV_scr_seq_T07R0203_000 + 1",
            "flag": "FLAG_NOTHING"
        },
        {
            "local_id": "obj_T07R0203_gsboy1",
            "graphics_id": "SPRITE_GSBOY1",
            "x": 14,
            "y": 6,
            "elevation": 0,
            "movement_type": "MOVEMENT_TYPE_NONE",
            "movement_range_x": 2,
            "movement_range_y": 0,
            "facing_dir": "DIR_NORTH",
            "trainer_type": "OBJECT_TYPE_NORMAL",
            "trainer_sight_or_param0": 0,
            "param1": 0,
            "param2": 0,
            "script": "_EV_scr_seq_T07R0203_009 + 1",
            "flag": "FLAG_NOTHING"
        },
        {
            "local_id": "obj_T07R0203_var_1",
            "graphics_id": "SPRITE_VAR_1",
            "x": 15,
            "y": 30,
            "elevation": 0,
            "movement_type": "MOVEMENT_TYPE_NONE",
            "movement_range_x": 0,
            "movement_range_y": 0,
            "facing_dir": "DIR_WEST",
            "trainer_type": "OBJECT_TYPE_NORMAL",
            "trainer_sight_or_param0": 0,
            "param1": 0,
            "param2": 0,
            "script": 0,
            "flag": "FLAG_NOTHING"
        },
        {
            "local_id": "obj_T07R0203_tsure_poke_static_marill",
            "graphics_id": "SPRITE_FOLLOWER_MON_STATIC_MARILL",
            "x": 16,
            "y": 30,
            "elevation": 0,
            "movement_type": "MOVEMENT_TYPE_NONE",
            "movement_range_x": 0,
            "movement_range_y": 0,
            "facing_dir": "DIR_WEST",
            "trainer_type": "OBJECT_TYPE_NORMAL",
            "trainer_sight_or_param0": 0,
            "param1": 0,
            "param2": 0,
            "script": 0,
            "flag": "FLAG_NOTHING"
        },
        {
            "local_id": "obj_T07R0203_suit",
            "graphics_id": "SPRITE_SUIT",
            "x": 8,
            "y": 12,
            "elevation": 0,
            "movement_type": "MOVEMENT_TYPE_NONE",
            "movement_range_x": 0,
            "movement_range_y": 0,
            "facing_dir": "DIR_SOUTH",
            "trainer_type": "OBJECT_TYPE_NORMAL",
            "trainer_sight_or_param0": 0,
            "param1": 0,
            "param2": 0,
            "script": "_EV_scr_seq_T07R0203_012 + 1",
            "flag": "FLAG_NOTHING"
        }
    ],
    "warp_events": [
        {
            "x": 3,
            "y": 2,
            "elevation": 0,
            "dest_map": "MAP_CELADON_CONDOMINIUMS_LEFT_ELEVATOR",
            "dest_warp_id": 0
        }
    ],
    "coord_events": [],
    "bg_events": [
        {
            "type": "BG_TYPE_NORMAL",
            "x": 5,
            "y": 2,
            "elevation": 0,
            "player_facing_dir": "BG_DIR_ALL",
            "script": "_EV_scr_seq_T07R0203_004 + 1"
        },
        {
            "type": "BG_TYPE_NORMAL",
            "x": 5,
            "y": 8,
            "elevation": 0,
            "player_facing_dir": "BG_DIR_SOUTH",
            "script": "_EV_scr_seq_T07R0203_007 + 1"
        },
        {
            "type": "BG_TYPE_NORMAL",
            "x": 5,
            "y": 12,
            "elevation": 0,
            "player_facing_dir": "BG_DIR_SOUTH",
            "script": "_EV_scr_seq_T07R0203_007 + 1"
        },
        {
            "type": "BG_TYPE_NORMAL",
            "x": 6,
            "y": 12,
            "elevation": 0,
            "player_facing_dir": "BG_DIR_SOUTH",
            "script": "_EV_scr_seq_T07R0203_007 + 1"
        },
        {
            "type": "BG_TYPE_NORMAL",
            "x": 10,
            "y": 12,
            "elevation": 0,
            "player_facing_dir": "BG_DIR_SOUTH",
            "script": "_EV_scr_seq_T07R0203_007 + 1"
        },
        {
            "type": "BG_TYPE_NORMAL",
            "x": 11,
            "y": 12,
            "elevation": 0,
            "player_facing_dir": "BG_DIR_SOUTH",
            "script": "_EV_scr_seq_T07R0203_007 + 1"
        },
        {
            "type": "BG_TYPE_NORMAL",
            "x": 10,
            "y": 8,
            "elevation": 0,
            "player_facing_dir": "BG_DIR_SOUTH",
            "script": "_EV_scr_seq_T07R0203_007 + 1"
        },
        {
            "type": "BG_TYPE_NORMAL",
            "x": 11,
            "y": 8,
            "elevation": 0,
            "player_facing_dir": "BG_DIR_SOUTH",
            "script": "_EV_scr_seq_T07R0203_007 + 1"
        },
        {
            "type": "BG_TYPE_NORMAL",
            "x": 1,
            "y": 9,
            "elevation": 0,
            "player_facing_dir": "BG_DIR_SOUTH",
            "script": "_EV_scr_seq_T07R0203_005 + 1"
        },
        {
            "type": "BG_TYPE_NORMAL",
            "x": 1,
            "y": 12,
            "elevation": 0,
            "player_facing_dir": "BG_DIR_SOUTH",
            "script": "_EV_scr_seq_T07R0203_005 + 1"
        },
        {
            "type": "BG_TYPE_NORMAL",
            "x": 14,
            "y": 9,
            "elevation": 0,
            "player_facing_dir": "BG_DIR_ALL",
            "script": "_EV_scr_seq_T07R0203_006 + 1"
        },
        {
            "type": "BG_TYPE_NORMAL",
            "x": 15,
            "y": 12,
            "elevation": 0,
            "player_facing_dir": "BG_DIR_ALL",
            "script": "_EV_scr_seq_T07R0203_006 + 1"
        },
        {
            "type": "BG_TYPE_NORMAL",
            "x": 15,
            "y": 9,
            "elevation": 0,
            "player_facing_dir": "BG_DIR_ALL",
            "script": "_EV_scr_seq_T07R0203_006 + 1"
        },
        {
            "type": "BG_TYPE_NORMAL",
            "x": 14,
            "y": 12,
            "elevation": 0,
            "player_facing_dir": "BG_DIR_ALL",
            "script": "_EV_scr_seq_T07R0203_006 + 1"
        },
        {
            "type": "BG_TYPE_NORMAL",
            "x": 7,
            "y": 2,
            "elevation": 0,
            "player_facing_dir": "BG_DIR_ALL",
            "script": "_EV_scr_seq_T07R0203_013 + 1"
        }
    ]
}
