{
    "id": "MAP_LAVENDER_HOUSE_OF_MEMORIES",
    "name": "Lavender_HouseOfMemories",
    "code": "T05R0601",
    "layout": "NARC_map_matrix_map_matrix_0194_T05R0601_bin",
    "music_day": "SEQ_GS_T_CHION",
    "music_night": "SEQ_GS_T_CHION",
    "region_map_section": "MAPSEC_LAVENDER_TOWN",
    "weather": 0,
    "map_type": "MAP_TYPE_INTERIOR",
    "battle_scene": "BATTLE_BG_BUILDING_1",
    "allow_cycling": false,
    "allow_escaping": false,
    "allow_running": true,
    "allow_fly": false,
    "allow_outgoing_calls": true,
    "allow_incoming_calls": true,
    "radio_signal": true,
    "wild_encounters": "ENCDATA_NA",
    "camera_type": 4,
    "follow_mode": "MAP_FOLLOWMODE_HEIGHT_RESTRICT",
    "region": "MAP_REGION_KANTO",
    "area_icon": 9,
    "mom_call_intro": 12,
    "world_map_x": 44,
    "world_map_y": 7,
    "area_data": 40,
    "move_model_bank": 15,
    "object_events": [
        {
            "local_id": "obj_T05R0601_gsoldman1",
            "graphics_id": "SPRITE_GSOLDMAN1",
            "x": 4,
            "y": 4,
            "elevation": 0,
            "movement_type": "MOVEMENT_TYPE_FACE_DOWN",
            "movement_range_x": 0,
            "movement_range_y": 0,
            "facing_dir": "DIR_SOUTH",
            "trainer_type": "OBJECT_TYPE_NORMAL",
            "trainer_sight_or_param0": 0,
            "param1": 0,
            "param2": 0,
            "script": "Lavender_HouseOfMemories_EventScript_MrFuji",
            "flag": "FLAG_NOTHING"
        },
        {
            "local_id": "obj_T05R0601_gsoldwoman1",
            "graphics_id": "SPRITE_GSOLDWOMAN1",
            "x": 12,
            "y": 8,
            "elevation": 0,
            "movement_type": "MOVEMENT_TYPE_FACE_UP",
            "movement_range_x": 0,
            "movement_range_y": 0,
            "facing_dir": "DIR_NORTH",
            "trainer_type": "OBJECT_TYPE_NORMAL",
            "trainer_sight_or_param0": 0,
            "param1": 0,
            "param2": 0,
            "script": "Lavender_HouseOfMemories_EventScript_OldWoman",
            "flag": "FLAG_NOTHING"
        },
        {
            "local_id": "obj_T05R0601_gsgirl1",
            "graphics_id": "SPRITE_GSGIRL1",
            "x": 7,
            "y": 12,
            "elevation": 0,
            "movement_type": "MOVEMENT_TYPE_FACE_UP",
            "movement_range_x": 0,
            "movement_range_y": 0,
            "facing_dir": "DIR_NORTH",
            "trainer_type": "OBJECT_TYPE_NORMAL",
            "trainer_sight_or_param0": 0,
            "param1": 0,
            "param2": 0,
            "script": "Lavender_HouseOfMemories_EventScript_Lass",
            "flag": "FLAG_NOTHING"
        },
        {
            "local_id": "obj_T05R0601_gswoman1",
            "graphics_id": "SPRITE_GSWOMAN1",
            "x": 8,
            "y": 12,
            "elevation": 0,
            "movement_type": "MOVEMENT_TYPE_FACE_UP",
            "movement_range_x": 0,
            "movement_range_y": 0,
            "facing_dir": "DIR_NORTH",
            "trainer_type": "OBJECT_TYPE_NORMAL",
            "trainer_sight_or_param0": 0,
            "param1": 0,
            "param2": 0,
            "script": "Lavender_HouseOfMemories_EventScript_Woman",
            "flag": "FLAG_NOTHING"
        }
    ],
    "warp_events": [
        {
            "x": 4,
            "y": 17,
            "elevation": 0,
            "dest_map": "MAP_LAVENDER",
            "dest_warp_id": 5
        }
    ],
    "coord_events": [],
    "bg_events": []
}
