{
    "id": "MAP_CERULEAN_BIKE_MANIAC_HOUSE",
    "name": "Cerulean_BikeManiacHouse",
    "code": "T04R0401",
    "layout": "NARC_map_matrix_map_matrix_0274_T04R0401_bin",
    "music_day": "SEQ_GS_C_HANADA",
    "music_night": "SEQ_GS_C_HANADA",
    "region_map_section": "MAPSEC_CERULEAN_CITY",
    "weather": 0,
    "map_type": "MAP_TYPE_INTERIOR",
    "battle_scene": "BATTLE_BG_BUILDING_1",
    "allow_cycling": false,
    "allow_escaping": false,
    "allow_running": true,
    "allow_fly": false,
    "allow_outgoing_calls": true,
    "allow_incoming_calls": true,
    "radio_signal": true,
    "wild_encounters": "ENCDATA_NA",
    "camera_type": 4,
    "follow_mode": "MAP_FOLLOWMODE_HEIGHT_RESTRICT",
    "region": "MAP_REGION_KANTO",
    "area_icon": 9,
    "mom_call_intro": 12,
    "world_map_x": 40,
    "world_map_y": 4,
    "area_data": 27,
    "move_model_bank": 15,
    "object_events": [
        {
            "local_id": "obj_T04R0401_gsmiddleman1",
            "graphics_id": "SPRITE_GSMIDDLEMAN1",
            "x": 2,
            "y": 4,
            "elevation": 0,
            "movement_type": "MOVEMENT_TYPE_FACE_UP",
            "movement_range_x": 0,
            "movement_range_y": 0,
            "facing_dir": "DIR_NORTH",
            "trainer_type": "OBJECT_TYPE_NORMAL",
            "trainer_sight_or_param0": 0,
            "param1": 0,
            "param2": 0,
            "script": "Cerulean_BikeManiacHouse_EventScript_PokefanM",
            "flag": "FLAG_NOTHING"
        }
    ],
    "warp_events": [
        {
            "x": 6,
            "y": 11,
            "elevation": 0,
            "dest_map": "MAP_CERULEAN",
            "dest_warp_id": 6
        }
    ],
    "coord_events": [],
    "bg_events": []
}
